{
  "schemaVersion": "ordo.construction-plan/1",
  "vocabularyVersion": "ordo.construction-vocabulary/6",
  "binding": {
    "sourceManifestDigest": "sha256:08ab2de381bcd68850640d0d4ac20917bdab934e2fff19d8215dea1b347d42ce",
    "blueprintDigest": "sha256:7995f51955bef374ae8af0df1ca631d596ddbf93a1389070b528b0e8887066fe",
    "cohortId": "COH-GATE",
    "decisionIds": [
      "DEC-GATE"
    ]
  },
  "operations": [
    {
      "op": "defineWorkflow",
      "name": "Session Gate",
      "trace": {
        "requirementKeys": [
          "synthetic/gate.md#GATE-1"
        ],
        "nodeIds": [
          "CON-GATE"
        ]
      }
    },
    {
      "op": "defineState",
      "name": "Closed",
      "role": "initial",
      "trace": {
        "requirementKeys": [
          "synthetic/gate.md#GATE-1"
        ],
        "nodeIds": [
          "CON-GATE"
        ]
      }
    },
    {
      "op": "defineState",
      "name": "Open",
      "role": "ordinary",
      "trace": {
        "requirementKeys": [
          "synthetic/gate.md#GATE-1"
        ],
        "nodeIds": [
          "CON-GATE"
        ]
      }
    },
    {
      "op": "defineState",
      "name": "Jammed",
      "role": "ordinary",
      "trace": {
        "requirementKeys": [
          "synthetic/gate.md#GATE-1",
          "synthetic/gate.md#GATE-2"
        ],
        "nodeIds": [
          "CON-GATE"
        ]
      }
    },
    {
      "op": "defineBranchingTransition",
      "command": "Raise",
      "from": "Closed",
      "targets": [
        "Open",
        "Jammed"
      ],
      "trace": {
        "requirementKeys": [
          "synthetic/gate.md#GATE-1",
          "synthetic/gate.md#GATE-2"
        ],
        "nodeIds": [
          "CON-GATE"
        ]
      }
    },
    {
      "op": "defineTransition",
      "command": "Lower",
      "from": "Open",
      "to": "Closed",
      "guards": [
        {
          "name": "path clear",
          "predicate": "extension"
        }
      ],
      "trace": {
        "requirementKeys": [
          "synthetic/gate.md#GATE-1",
          "synthetic/gate.md#GATE-3"
        ],
        "nodeIds": [
          "CON-GATE"
        ]
      }
    },
    {
      "op": "defineTransition",
      "command": "Reset",
      "from": "Jammed",
      "to": "Closed",
      "guards": [],
      "trace": {
        "requirementKeys": [
          "synthetic/gate.md#GATE-1"
        ],
        "nodeIds": [
          "CON-GATE"
        ]
      }
    },
    {
      "op": "declarePairRule",
      "unlisted": "refused",
      "trace": {
        "requirementKeys": [
          "synthetic/gate.md#GATE-1"
        ],
        "nodeIds": [
          "CON-GATE"
        ]
      }
    },
    {
      "op": "defineRefusal",
      "command": "Raise",
      "from": "Open",
      "trace": {
        "requirementKeys": [
          "synthetic/gate.md#GATE-1",
          "synthetic/gate.md#GATE-4"
        ],
        "nodeIds": [
          "CON-GATE"
        ]
      }
    },
    {
      "op": "defineRefusalCode",
      "code": "AlreadyOpen",
      "trace": {
        "requirementKeys": [
          "synthetic/gate.md#GATE-4"
        ],
        "nodeIds": [
          "CON-GATE"
        ]
      }
    },
    {
      "op": "defineRefusalCode",
      "code": "Obstructed",
      "trace": {
        "requirementKeys": [
          "synthetic/gate.md#GATE-4"
        ],
        "nodeIds": [
          "CON-GATE"
        ]
      }
    },
    {
      "op": "defineRefusalCode",
      "code": "NotAccepted",
      "trace": {
        "requirementKeys": [
          "synthetic/gate.md#GATE-4"
        ],
        "nodeIds": [
          "CON-GATE"
        ]
      }
    },
    {
      "op": "assignRefusalCode",
      "target": {
        "kind": "pair",
        "from": "Open",
        "command": "Raise"
      },
      "code": "AlreadyOpen",
      "trace": {
        "requirementKeys": [
          "synthetic/gate.md#GATE-4"
        ],
        "nodeIds": [
          "CON-GATE"
        ]
      }
    },
    {
      "op": "assignRefusalCode",
      "target": {
        "kind": "guard",
        "name": "path clear"
      },
      "code": "Obstructed",
      "trace": {
        "requirementKeys": [
          "synthetic/gate.md#GATE-3",
          "synthetic/gate.md#GATE-4"
        ],
        "nodeIds": [
          "CON-GATE"
        ]
      }
    },
    {
      "op": "assignRefusalCode",
      "target": {
        "kind": "unlisted"
      },
      "code": "NotAccepted",
      "trace": {
        "requirementKeys": [
          "synthetic/gate.md#GATE-4"
        ],
        "nodeIds": [
          "CON-GATE"
        ]
      }
    },
    {
      "op": "declareExtensionInventory",
      "extension": {
        "kind": "guard",
        "name": "path clear"
      },
      "decisionPoints": [],
      "trace": {
        "requirementKeys": [
          "synthetic/gate.md#GATE-3"
        ],
        "nodeIds": [
          "CON-GATE"
        ]
      }
    },
    {
      "op": "declareExtensionInventory",
      "extension": {
        "kind": "selection",
        "from": "Closed",
        "command": "Raise"
      },
      "decisionPoints": [
        {
          "point": "motor report",
          "decided": true,
          "trace": {
            "requirementKeys": [
              "synthetic/gate.md#GATE-2"
            ],
            "nodeIds": [
              "CON-GATE"
            ]
          }
        }
      ],
      "trace": {
        "requirementKeys": [
          "synthetic/gate.md#GATE-2"
        ],
        "nodeIds": [
          "CON-GATE"
        ]
      }
    },
    {
      "op": "declarePersistence",
      "idempotency": "session",
      "onStale": "escalate",
      "trace": {
        "requirementKeys": [
          "synthetic/gate.md#GATE-5"
        ],
        "nodeIds": [
          "CON-GATE"
        ]
      }
    }
  ]
}
